{
  "dataset_id": "fmu-002351",
  "source_repo": "fmi-cross-check-master",
  "source_path": "fmus/2.0/cs/linux64/EDALab_HIFSuite/2017.05_antlia/uart/uart.fmu",
  "source_commit": "",
  "fmi": {
    "fmiVersion": "2.0",
    "fmiTypes": [
      "CoSimulation"
    ],
    "modelName": "uart",
    "guid": "e051cb2a-14a6-44c0-8970-ad8eda55a10f",
    "description": "uart design",
    "author": "",
    "generationTool": "HIF2VP",
    "generationDateAndTime": "2018-01-17T16:29:02",
    "variableNamingConvention": "flat",
    "numberOfEventIndicators": 0
  },
  "implementation": {
    "platforms": [
      "linux64"
    ],
    "coSimulation": {
      "modelIdentifier": "uart",
      "needsExecutionTool": false,
      "canBeInstantiatedOnlyOncePerProcess": false,
      "canNotUseMemoryManagementFunctions": false,
      "canGetAndSetFMUstate": false,
      "canSerializeFMUstate": false,
      "providesDirectionalDerivative": false,
      "canHandleVariableCommunicationStepSize": false,
      "canInterpolateInputs": false,
      "canRunAsynchronuously": false,
      "maxOutputDerivativeOrder": 0
    }
  },
  "variables": [
    {
      "name": "paddr",
      "valueReference": 0,
      "causality": "input",
      "variability": "discrete",
      "type": "Integer",
      "description": "uint8",
      "start": 0,
      "min": 0.0,
      "max": 255.0
    },
    {
      "name": "pwdata",
      "valueReference": 1,
      "causality": "input",
      "variability": "discrete",
      "type": "Integer",
      "description": "uint8",
      "start": 0,
      "min": 0.0,
      "max": 255.0
    },
    {
      "name": "prdata",
      "valueReference": 2,
      "causality": "output",
      "variability": "discrete",
      "type": "Integer",
      "description": "uint8",
      "initial": "approx",
      "start": 0,
      "min": 0.0,
      "max": 255.0
    },
    {
      "name": "presetn",
      "valueReference": 0,
      "causality": "input",
      "variability": "discrete",
      "type": "Boolean",
      "description": "bool",
      "start": false
    },
    {
      "name": "psel",
      "valueReference": 1,
      "causality": "input",
      "variability": "discrete",
      "type": "Boolean",
      "description": "bool",
      "start": false
    },
    {
      "name": "penable",
      "valueReference": 2,
      "causality": "input",
      "variability": "discrete",
      "type": "Boolean",
      "description": "bool",
      "start": false
    },
    {
      "name": "pwrite",
      "valueReference": 3,
      "causality": "input",
      "variability": "discrete",
      "type": "Boolean",
      "description": "bool",
      "start": false
    },
    {
      "name": "br_clk",
      "valueReference": 4,
      "causality": "input",
      "variability": "discrete",
      "type": "Boolean",
      "description": "bool",
      "start": false
    },
    {
      "name": "srx",
      "valueReference": 5,
      "causality": "input",
      "variability": "discrete",
      "type": "Boolean",
      "description": "bool",
      "start": false
    },
    {
      "name": "ctsn",
      "valueReference": 6,
      "causality": "input",
      "variability": "discrete",
      "type": "Boolean",
      "description": "bool",
      "start": false
    },
    {
      "name": "dsrn",
      "valueReference": 7,
      "causality": "input",
      "variability": "discrete",
      "type": "Boolean",
      "description": "bool",
      "start": false
    },
    {
      "name": "rin",
      "valueReference": 8,
      "causality": "input",
      "variability": "discrete",
      "type": "Boolean",
      "description": "bool",
      "start": false
    },
    {
      "name": "dcdn",
      "valueReference": 9,
      "causality": "input",
      "variability": "discrete",
      "type": "Boolean",
      "description": "bool",
      "start": false
    },
    {
      "name": "stx",
      "valueReference": 10,
      "causality": "output",
      "variability": "discrete",
      "type": "Boolean",
      "description": "bool",
      "initial": "approx",
      "start": false
    },
    {
      "name": "dtrn",
      "valueReference": 11,
      "causality": "output",
      "variability": "discrete",
      "type": "Boolean",
      "description": "bool",
      "initial": "approx",
      "start": false
    },
    {
      "name": "rtsn",
      "valueReference": 12,
      "causality": "output",
      "variability": "discrete",
      "type": "Boolean",
      "description": "bool",
      "initial": "approx",
      "start": false
    },
    {
      "name": "out1n",
      "valueReference": 13,
      "causality": "output",
      "variability": "discrete",
      "type": "Boolean",
      "description": "bool",
      "initial": "approx",
      "start": false
    },
    {
      "name": "out2n",
      "valueReference": 14,
      "causality": "output",
      "variability": "discrete",
      "type": "Boolean",
      "description": "bool",
      "initial": "approx",
      "start": false
    },
    {
      "name": "txrdyn",
      "valueReference": 15,
      "causality": "output",
      "variability": "discrete",
      "type": "Boolean",
      "description": "bool",
      "initial": "approx",
      "start": false
    },
    {
      "name": "rxrdyn",
      "valueReference": 16,
      "causality": "output",
      "variability": "discrete",
      "type": "Boolean",
      "description": "bool",
      "initial": "approx",
      "start": false
    },
    {
      "name": "irq",
      "valueReference": 17,
      "causality": "output",
      "variability": "discrete",
      "type": "Boolean",
      "description": "bool",
      "initial": "approx",
      "start": false
    },
    {
      "name": "b_clk",
      "valueReference": 18,
      "causality": "output",
      "variability": "discrete",
      "type": "Boolean",
      "description": "bool",
      "initial": "approx",
      "start": false
    }
  ],
  "interface": {
    "inputs": [
      "paddr",
      "pwdata",
      "presetn",
      "psel",
      "penable",
      "pwrite",
      "br_clk",
      "srx",
      "ctsn",
      "dsrn",
      "rin",
      "dcdn"
    ],
    "outputs": [
      "prdata",
      "stx",
      "dtrn",
      "rtsn",
      "out1n",
      "out2n",
      "txrdyn",
      "rxrdyn",
      "irq",
      "b_clk"
    ]
  },
  "test": {
    "hasReferenceInput": true,
    "hasReferenceOutput": true,
    "referenceInputFile": "uart_in.csv",
    "referenceOutputFile": "uart_ref.csv",
    "simulationOptionsFile": "uart_simopt.json"
  },
  "validation": {
    "fmiCompliance": "not_checked"
  }
}