{
  "dataset_id": "fmu-002268",
  "source_repo": "fmi-cross-check-master",
  "source_path": "fmus/2.0/cs/linux64/Test-FMUs/0.0.1/Stair/Stair.fmu",
  "source_commit": "",
  "fmi": {
    "fmiVersion": "2.0",
    "fmiTypes": [
      "ModelExchange",
      "CoSimulation"
    ],
    "modelName": "Stair",
    "guid": "{8c4e810f-3df3-4a00-8276-176fa3c9f008}",
    "description": "",
    "author": "",
    "generationTool": "",
    "generationDateAndTime": "",
    "variableNamingConvention": "flat",
    "numberOfEventIndicators": 0,
    "defaultExperiment": {
      "startTime": 0.0,
      "stopTime": 10.0
    }
  },
  "implementation": {
    "platforms": [
      "linux64",
      "c-code"
    ],
    "modelExchange": {
      "modelIdentifier": "Stair"
    },
    "coSimulation": {
      "modelIdentifier": "Stair",
      "canHandleVariableCommunicationStepSize": true
    }
  },
  "variables": [
    {
      "name": "counter",
      "valueReference": 0,
      "causality": "output",
      "variability": "continuous",
      "type": "Integer",
      "description": "counts the seconds",
      "initial": "exact",
      "start": 1
    }
  ],
  "interface": {
    "outputs": [
      "counter"
    ]
  },
  "test": {
    "hasReferenceInput": false,
    "hasReferenceOutput": true,
    "referenceOutputFile": "Stair_ref.csv",
    "simulationOptionsFile": "Stair_simopt.json"
  },
  "validation": {
    "fmiCompliance": "not_checked"
  }
}